{"$schema":"https://json-schema.org/draft/2020-12/schema","additionalProperties":false,"properties":{"config_revision":{"const":"g2-pr3-config-v1","default":"g2-pr3-config-v1","title":"Config Revision","type":"string"},"extractor_revision":{"const":"g2-paragraph-claims-v1","default":"g2-paragraph-claims-v1","title":"Extractor Revision","type":"string"},"granularity":{"const":"whole_paragraph","default":"whole_paragraph","title":"Granularity","type":"string"},"history_revision":{"const":"g2-claim-history-v1","default":"g2-claim-history-v1","title":"History Revision","type":"string"},"independent_support":{"const":"disabled","default":"disabled","title":"Independent Support","type":"string"},"max_archived_claims":{"const":4096,"default":4096,"title":"Max Archived Claims","type":"integer"},"max_claims_per_document":{"const":32,"default":32,"title":"Max Claims Per Document","type":"integer"},"max_claims_per_event":{"const":128,"default":128,"title":"Max Claims Per Event","type":"integer"},"max_comparisons":{"const":32768,"default":32768,"title":"Max Comparisons","type":"integer"},"max_documents":{"const":256,"default":256,"title":"Max Documents","type":"integer"},"max_paragraphs":{"const":4096,"default":4096,"title":"Max Paragraphs","type":"integer"},"max_quote_chars":{"const":1024,"default":1024,"title":"Max Quote Chars","type":"integer"},"max_visible_chars":{"const":1048576,"default":1048576,"title":"Max Visible Chars","type":"integer"},"parent_schema_revision":{"const":"g2-pr2-1","default":"g2-pr2-1","title":"Parent Schema Revision","type":"string"},"relation_revision":{"const":"g2-evidence-relations-v1","default":"g2-evidence-relations-v1","title":"Relation Revision","type":"string"},"scope_revision":{"const":"g2-claim-scope-v1","default":"g2-claim-scope-v1","title":"Scope Revision","type":"string"}},"title":"PR3Config","type":"object"}
