{"config_revision":"g2-pr3-config-v1","extractor_revision":"g2-paragraph-claims-v1","granularity":"whole_paragraph","history_revision":"g2-claim-history-v1","independent_support":"disabled","max_archived_claims":4096,"max_claims_per_document":32,"max_claims_per_event":128,"max_comparisons":32768,"max_documents":256,"max_paragraphs":4096,"max_quote_chars":1024,"max_visible_chars":1048576,"parent_schema_revision":"g2-pr2-1","relation_revision":"g2-evidence-relations-v1","scope_revision":"g2-claim-scope-v1"}
